<?xml version="1.0" encoding="UTF-8"?>
<xsd:schema xmlns:xsd="http://www.w3.org/2001/XMLSchema" xmlns:od="urn:schemas-microsoft-com:officedata">
<xsd:element name="dataroot">
<xsd:complexType>
<xsd:sequence>
<xsd:element ref="Départs" minOccurs="0" maxOccurs="unbounded"/>
</xsd:sequence>
<xsd:attribute name="generated" type="xsd:dateTime"/>
</xsd:complexType>
</xsd:element>
<xsd:element name="Départs">
<xsd:annotation>
<xsd:appinfo>
<od:index index-name="PrimaryKey" index-key="N_x00B0_dépt " primary="yes" unique="yes" clustered="no" order="asc"/>
<od:tableProperty name="OrderByOn" type="1" value="0"/>
<od:tableProperty name="Orientation" type="2" value="0"/>
<od:tableProperty name="DefaultView" type="2" value="2"/>
<od:tableProperty name="NameMap" type="11" value="CswOVQAAAAA/SytRRG/iSY3HOfMITKlIAAAAAOkiIitRLORA/PFcL8QIYwBEAOkA
cABhAHIAdABzAAAAAAAAAJeBkuLH0gNDtun4npXOKFkAAAAAoCaD2lAs5EAAAAAA
HHgqAEMAbwBtAGkAdADpAHMAAAAAAAAAju9wvQc8FUu6ngjrL+ZHhAcAAAA/SytR
RG/iSY3HOfMITKlITgCwAGQA6QBwAHQAAAAAAAAAuGsDMhGv1km+/ky6Ml7+9wcA
AAA/SytRRG/iSY3HOfMITKlIRADpAHAAYQByAHQAZQBtAGUAbgB0AAAAAAAAAAAA
AAAAAAAAAAAAAAAAAAAMAAAABAAAAAAAAAAAAAAAAAAAAAAA
"/>
<od:tableProperty name="DisplayViewsOnSharePointSite" type="2" value="1"/>
<od:tableProperty name="TotalsRow" type="1" value="0"/>
<od:tableProperty name="FilterOnLoad" type="1" value="0"/>
<od:tableProperty name="OrderByOnLoad" type="1" value="1"/>
<od:tableProperty name="HideNewField" type="1" value="0"/>
<od:tableProperty name="GUID" type="9" value="P0srUURv4kmNxznzCEypSA==
"/>
</xsd:appinfo>
</xsd:annotation>
<xsd:complexType>
<xsd:sequence>
<xsd:element name="N_x00B0_dépt" minOccurs="1" od:jetType="autonumber" od:sqlSType="int" od:autoUnique="yes" od:nonNullable="yes" type="xsd:int">
<xsd:annotation>
<xsd:appinfo>
<od:fieldProperty name="ColumnWidth" type="3" value="1200"/>
<od:fieldProperty name="ColumnOrder" type="3" value="1"/>
<od:fieldProperty name="ColumnHidden" type="1" value="0"/>
<od:fieldProperty name="TextAlign" type="2" value="0"/>
<od:fieldProperty name="AggregateType" type="4" value="-1"/>
<od:fieldProperty name="GUID" type="9" value="ju9wvQc8FUu6ngjrL+ZHhA==
"/>
</xsd:appinfo>
</xsd:annotation>
</xsd:element>
<xsd:element name="Département" minOccurs="0" od:jetType="text" od:sqlSType="nvarchar">
<xsd:annotation>
<xsd:appinfo>
<od:fieldProperty name="ColumnWidth" type="3" value="2340"/>
<od:fieldProperty name="ColumnOrder" type="3" value="2"/>
<od:fieldProperty name="ColumnHidden" type="1" value="0"/>
<od:fieldProperty name="Required" type="1" value="0"/>
<od:fieldProperty name="AllowZeroLength" type="1" value="0"/>
<od:fieldProperty name="DisplayControl" type="3" value="109"/>
<od:fieldProperty name="IMEMode" type="2" value="0"/>
<od:fieldProperty name="IMESentenceMode" type="2" value="3"/>
<od:fieldProperty name="UnicodeCompression" type="1" value="1"/>
<od:fieldProperty name="TextAlign" type="2" value="0"/>
<od:fieldProperty name="AggregateType" type="4" value="-1"/>
<od:fieldProperty name="GUID" type="9" value="uGsDMhGv1km+/ky6Ml7+9w==
"/>
</xsd:appinfo>
</xsd:annotation>
<xsd:simpleType>
<xsd:restriction base="xsd:string">
<xsd:maxLength value="50"/>
</xsd:restriction>
</xsd:simpleType>
</xsd:element>
</xsd:sequence>
</xsd:complexType>
</xsd:element>
</xsd:schema>
